{
  "version": "1.0.0",
  "formula_language": "expr-v1",
  "act": 2,
  "stats": [
    "P",
    "V",
    "O",
    "W",
    "S",
    "M",
    "Food",
    "Med",
    "Tar",
    "Timber",
    "Wounds",
    "A2"
  ],
  "flags": [
    "ending_vector",
    "chapter1",
    "famine",
    "oath_shattered",
    "oath_cracked",
    "mutiny",
    "sickness",
    "ledger_obtained",
    "thrall_network",
    "governance",
    "ring_visibility",
    "route_plan",
    "cargo_policy",
    "blizzard_call",
    "investigation_method",
    "accusation",
    "sentence",
    "innocent_blood",
    "battle_plan",
    "ally_call",
    "gate_crisis",
    "claim",
    "ring_fate",
    "oath_form",
    "act3_start_state"
  ],
  "meta": {
    "A2_seed_expression": "A2 = (chapter1=='dominant'?15:chapter1=='stable'?8:chapter1=='fragile'?0:-10) + (ending_vector=='conquest'?6:ending_vector=='accord'?6:ending_vector=='ashen'?5:ending_vector=='exile'?3:0) - (famine?8:0)",
    "A2_delta_rule": "if score>=80 => +8; 65-79 => +4; 50-64 => +0; <50 => -6"
  },
  "quests": [
    {
      "quest_id": "Q6_CROWN_OR_COVENANT",
      "order": 6,
      "title": "Crown or Covenant",
      "beat": [
        "[Sigrid] 'Pick a rule before winter picks one for us.'",
        "[Hakon] 'Steel or law. Decide.'",
        "[Yrsa] 'Ash is also a law.'"
      ],
      "nodes": [
        {
          "node_id": "Q6_C1",
          "prompt": "Choose governance model.",
          "choices": [
            {
              "choice_id": "Q6_C1_A",
              "text": "Iron Tithe",
              "effects": [
                {"target": "P", "op": "add", "value": 10},
                {"target": "V", "op": "add", "value": -8},
                {"target": "O", "op": "add", "value": -6},
                {"target": "W", "op": "add", "value": 4},
                {"target": "M", "op": "add", "value": -2}
              ],
              "set_flags": {
                "governance": "iron_tithe"
              }
            },
            {
              "choice_id": "Q6_C1_B",
              "text": "Fjord Charter",
              "effects": [
                {"target": "V", "op": "add", "value": 8},
                {"target": "O", "op": "add", "value": 10},
                {"target": "P", "op": "add", "value": -3},
                {"target": "M", "op": "add", "value": 3},
                {"target": "W", "op": "add", "value": 2}
              ],
              "set_flags": {
                "governance": "fjord_charter"
              }
            },
            {
              "choice_id": "Q6_C1_C",
              "text": "Ash Covenant",
              "effects": [
                {"target": "S", "op": "add", "value": 12},
                {"target": "O", "op": "add", "value": -8},
                {"target": "W", "op": "add", "value": 4},
                {"target": "M", "op": "add", "value": -1}
              ],
              "set_flags": {
                "governance": "ash_covenant"
              }
            }
          ]
        },
        {
          "node_id": "Q6_C2",
          "prompt": "Handle incoming refugee boats.",
          "choices": [
            {
              "choice_id": "Q6_C2_A",
              "text": "Turn boats away",
              "effects": [
                {"target": "Food", "op": "add", "value": 2},
                {"target": "W", "op": "add", "value": 3},
                {"target": "O", "op": "add", "value": -8},
                {"target": "V", "op": "add", "value": -5},
                {"target": "M", "op": "add", "value": -3}
              ]
            },
            {
              "choice_id": "Q6_C2_B",
              "text": "Accept and ration",
              "effects": [
                {"target": "Food", "op": "add", "value": -2},
                {"target": "Med", "op": "add", "value": -1},
                {"target": "O", "op": "add", "value": 8},
                {"target": "V", "op": "add", "value": 4},
                {"target": "M", "op": "add", "value": 5}
              ]
            },
            {
              "choice_id": "Q6_C2_C",
              "text": "Smuggle selected families",
              "effects": [
                {"target": "Food", "op": "add", "value": -1},
                {"target": "O", "op": "add", "value": 2},
                {"target": "M", "op": "add", "value": 2},
                {"target": "S", "op": "add", "value": 2}
              ],
              "notes": "If ending_vector == 'exile', apply additional stealth bonus in runtime resolver."
            }
          ]
        },
        {
          "node_id": "Q6_C3",
          "prompt": "Who sees the ring?",
          "choices": [
            {
              "choice_id": "Q6_C3_A",
              "text": "Show crew only",
              "effects": [
                {"target": "P", "op": "add", "value": 6},
                {"target": "M", "op": "add", "value": 3},
                {"target": "O", "op": "add", "value": 2}
              ],
              "set_flags": {
                "ring_visibility": "crew_only"
              }
            },
            {
              "choice_id": "Q6_C3_B",
              "text": "Show jarls publicly",
              "effects": [
                {"target": "V", "op": "add", "value": 7},
                {"target": "O", "op": "add", "value": 6},
                {"target": "P", "op": "add", "value": -2}
              ],
              "set_flags": {
                "ring_visibility": "public_jarls"
              }
            },
            {
              "choice_id": "Q6_C3_C",
              "text": "Give to seers for reading",
              "effects": [
                {"target": "S", "op": "add", "value": 10},
                {"target": "O", "op": "add", "value": -6}
              ],
              "set_flags": {
                "ring_visibility": "seer_reading"
              }
            }
          ]
        }
      ],
      "scoring": {
        "rules": [
          {
            "id": "fit_bonus",
            "expression": "fit_bonus = ((ending_vector=='conquest' && governance=='iron_tithe') ? 10 : (ending_vector=='accord' && governance=='fjord_charter') ? 10 : (ending_vector=='ashen' && governance=='ash_covenant') ? 10 : (ending_vector=='exile' && governance=='ash_covenant') ? 4 : -4)"
          },
          {
            "id": "humanity",
            "expression": "humanity = (choice('Q6_C2')=='Q6_C2_A' ? -8 : choice('Q6_C2')=='Q6_C2_B' ? 8 : 2)"
          },
          {
            "id": "q6_score",
            "expression": "q6_score = clamp(32 + 0.18*W + 0.18*M + 0.18*O + fit_bonus + humanity - (famine?8:0) - (oath_shattered?10:0), 0, 100)"
          }
        ],
        "final_score": "q6_score",
        "bands": [
          {
            "min": 80,
            "max": 100,
            "label": "clean_success",
            "effects": [{"target": "A2", "op": "add", "value": 8}],
            "set_flags": {"Q6_result": "clean_success"}
          },
          {
            "min": 65,
            "max": 79,
            "label": "costly_success",
            "effects": [{"target": "A2", "op": "add", "value": 4}],
            "set_flags": {"Q6_result": "costly_success"}
          },
          {
            "min": 50,
            "max": 64,
            "label": "contested",
            "effects": [{"target": "A2", "op": "add", "value": 0}],
            "set_flags": {"Q6_result": "contested"}
          },
          {
            "min": 0,
            "max": 49,
            "label": "failure",
            "effects": [{"target": "A2", "op": "add", "value": -6}],
            "set_flags": {"Q6_result": "failure"}
          }
        ]
      }
    },
    {
      "quest_id": "Q7_WHALE_ROAD",
      "order": 7,
      "title": "Whale Road Convoy",
      "beat": [
        "[Astrid] 'If convoy fails, no one eats.'",
        "[Leif] 'If convoy slows, everyone dies.'"
      ],
      "nodes": [
        {
          "node_id": "Q7_C1",
          "prompt": "Select convoy route.",
          "choices": [
            {
              "choice_id": "Q7_C1_A",
              "text": "Ice-channel stealth",
              "effects": [
                {"target": "O", "op": "add", "value": 4},
                {"target": "W", "op": "add", "value": 6},
                {"target": "P", "op": "add", "value": 2}
              ],
              "set_flags": {"route_plan": "ice_stealth"}
            },
            {
              "choice_id": "Q7_C1_B",
              "text": "Open-sea strike run",
              "effects": [
                {"target": "P", "op": "add", "value": 8},
                {"target": "W", "op": "add", "value": 4},
                {"target": "V", "op": "add", "value": -4},
                {"target": "Wounds", "op": "add", "value": 1}
              ],
              "set_flags": {"route_plan": "open_sea"}
            },
            {
              "choice_id": "Q7_C1_C",
              "text": "Village-chain escort pact",
              "effects": [
                {"target": "V", "op": "add", "value": 8},
                {"target": "O", "op": "add", "value": 6},
                {"target": "W", "op": "add", "value": 5},
                {"target": "P", "op": "add", "value": -2}
              ],
              "set_flags": {"route_plan": "escort_pact"}
            },
            {
              "choice_id": "Q7_C1_D",
              "text": "Ash-fog ritual route",
              "effects": [
                {"target": "S", "op": "add", "value": 10},
                {"target": "W", "op": "add", "value": 5},
                {"target": "O", "op": "add", "value": -5}
              ],
              "set_flags": {"route_plan": "ash_fog"}
            }
          ]
        },
        {
          "node_id": "Q7_C2",
          "prompt": "Set cargo distribution policy.",
          "choices": [
            {
              "choice_id": "Q7_C2_A",
              "text": "Pirate cargo first",
              "effects": [
                {"target": "P", "op": "add", "value": 6},